{
  "id": "dev.idlewarden.master-healer-kale-bridge",
  "name": "IdleWarden bridge for Master Healer Kale",
  "description": "Reports the party, its shields, the mana, every unlocked spell and what the tavern can buy over a local pipe, and casts through the game's own StartCastingSpell so the game validates cooldown, mana and target itself. Needs BepInEx already installed in the game.",
  "authors": ["The IdleWarden contributors"],
  "license": "MPL-2.0",
  "homepage": "https://github.com/IdleWarden/idlewarden/tree/main/mods/kale",
  "plugin": "dev.idlewarden.master-healer-kale",
  "bridge": { "name": "master-healer-kale" },
  "loader": "bepinex",
  "game": {
    "title": "Master Healer Kale",
    "steam_appid": 4634490
  },
  "source": {
    "repository": "https://github.com/IdleWarden/idlewarden"
  },
  "trust": "official",
  "versions": [
    {
      "version": "26.10.6",
      "api_version": "^0.1",
      "url": "https://github.com/IdleWarden/idlewarden/releases/download/mod%2Fkale%40v26.10.6/IdleWarden.Kale-26.10.6.zip",
      "sha256": "6731dc049ab61a3d63a16a41f21db1e71b0d54e591ba106c2b0c26d5cda9c411",
      "attestation": { "repository": "IdleWarden/idlewarden" },
      "game_versions": ["1.5"]
    },
    {
      "version": "26.10.4",
      "api_version": "^0.1",
      "url": "https://github.com/IdleWarden/idlewarden/releases/download/mod%2Fkale%40v26.10.4/IdleWarden.Kale-26.10.4.zip",
      "sha256": "4d52570c3bcca8f80f848c5c09a2397f58ba7789c41b52de76fc74df2de4c703",
      "attestation": { "repository": "IdleWarden/idlewarden" },
      "game_versions": ["1.5"]
    },
    {
      "version": "26.10.2",
      "api_version": "^0.1",
      "url": "https://github.com/IdleWarden/idlewarden/releases/download/mod%2Fkale%40v26.10.2/IdleWarden.Kale-26.10.2.zip",
      "sha256": "91570ce633f6a35f06096b70a7a5a9bcb32d157ea62faf09a20c0f29e1cda36f",
      "attestation": { "repository": "IdleWarden/idlewarden" },
      "game_versions": ["1.5"]
    },
    {
      "version": "26.9.4",
      "api_version": "^0.1",
      "url": "https://github.com/IdleWarden/idlewarden/releases/download/mod%2Fkale%40v26.9.4/IdleWarden.Kale-26.9.4.zip",
      "sha256": "11ce8c4b2283eb3a16af449c315429b0d7c60ec23e63b5d07836e27e91cdf4a7",
      "attestation": { "repository": "IdleWarden/idlewarden" },
      "game_versions": ["1.5"]
    },
    {
      "version": "26.9.2",
      "api_version": "^0.1",
      "url": "https://github.com/IdleWarden/idlewarden/releases/download/mod%2Fkale%40v26.9.2/IdleWarden.Kale-26.9.2.zip",
      "sha256": "2ea9e16352c7f73a897a4dee4d367a045134609412fb71494ea4f52dce13f14f",
      "attestation": { "repository": "IdleWarden/idlewarden" },
      "game_versions": ["1.5"]
    }
  ]
}
